{
  "v": 1,
  "type": "portal-link-request",
  "from_world": "svet-b.example.org",
  "from_api_url": "https://svet-b.example.org:7400",
  "from_portal": "1192f3a1-5b1e-7c3a-9d4e-1a2b3c4d5e6f",
  "from_name": "brana-jih",
  "to_world": "svet-a.example.org",
  "to_portal": "0192f3a1-5b1e-7c3a-9d4e-1a2b3c4d5e6f",
  "issued": 1791135700,
  "expires": 1791136000
}
